,id,rank,legalStatus,type,title,summary,applicant,applicationDate,mainIpc,applicationNumber,documentNumber,documentDate,inventor,applicantType,ipc,cpc,imagePath
22,US2021194091A1,0,公开,发明申请,"SEPARATORS, BATTERIES, SYSTEMS, VEHICLES, AND RELATED METHODS","Improved battery separators, base films or membranes, batteries, cells, devices, systems, vehicles, and/or methods of making and/or using such separators, films or membranes, batteries, cells, devices, systems, vehicles, and/or methods of enhancing battery or cell charge rates, charge capacity, and/or discharge rates, and/or methods of improving batteries, systems including such batteries, vehicles including such batteries and/or systems, and/or the like; biaxially oriented porous membranes, composites including biaxially oriented porous membranes, biaxially oriented microporous membranes, biaxially oriented macroporous membranes, battery separators with improved charge capacities and the related methods and methods of manufacture, methods of use, and the like; flat sheet membranes, liquid retention media; dry process separators; biaxially stretched separators; dry process biaxially stretched separators having a thickness range between about 5 μm and 50 μm, preferably between about 10 μm and 25 μm, having improved strength, high porosity, and unexpectedly and/or surprisingly high charge capacity, such as, for example, high 10 C rate charge capacity; separators or membranes with high charge capacity and high porosity, excellent charge rate and/or charge capacity performance in a rechargeable and/or secondary lithium battery, such as a lithium ion battery, for high power and/or high energy applications, cells, devices, systems, and/or vehicles, and/or the like; single or multiple ply or layer separators, monolayer separators, trilayer separators, composite separators, laminated separators, co-extruded separators, coated separators, 1 C or higher separators, at least 1 C separators, batteries, cells, systems, devices, vehicles, and/or the like; improved microporous battery separators for secondary lithium batteries, improved microporous battery separators with enhanced or high charge (C) rates, discharge (C) rates, and/or enhanced or high charge capacities in or for secondary lithium batteries, and/or related methods of manufacture, use, and/or the like, and/or combinations thereof are disclosed or provided.","Celgard, LLC",2021-03-09,H01M50/411,US17195645,US20210194091A1,2021-06-24,Xiaomin Zhang; Gerald P. Rumierz; Karl F. Humiston; Charles E. Haire; Tyrone S. Fields; Michael A. Braswell; Ronald A. Proctor; Ronnie E. Smith,企业,H01M50/411; B29C48/00; B29C48/21; B29C48/92; B29C48/08; B29C48/10; B29C48/18; B29C55/00; H01M50/449; H01M50/463; B29C65/00,,/docs/US/2021-06-24/US20210194091A1/abs.jpg.150x150.jpg
23,US2021193903A1,0,公开,发明申请,"FINGERPRINT IDENTIFICATION MODULE, METHOD FOR FORMING FINGERPRINT IDENTIFICATION MODULE, AND ELECTRONIC DEVICE","Fingerprint identification modules, methods for forming the fingerprint identification modules and electronic devices are provided. The method may include providing a substrate, containing a signal process circuit formed therein; providing a carrier substrate; forming one or more piezoelectric transducers on the carrier substrate, wherein a piezoelectric transducer of the one or more piezoelectric transducers includes a first electrode, a piezoelectric layer on the first electrode and a second electrode on the piezoelectric layer; forming a permanent bonding layer, containing one or more cavities, on one of the carrier substrate and the substrate; bonding the carrier substrate with the substrate using the permanent bonding layer, wherein the permanent bonding layer is between the one or more piezoelectric transducers and the substrate, and each piezoelectric transducer covers one cavity; and removing the carrier substrate.",Ningbo Semiconductor International Corporation,2021-03-09,H01L41/113,US17196153,US20210193903A1,2021-06-24,Hu SHI; Mengbin LIU; Yanghui XIANG,企业,H01L41/113; H01L41/047; H01L41/312; H01L41/27; H01L41/08; G06K9/00,,/docs/US/2021-06-24/US20210193903A1/abs.jpg.150x150.jpg
24,US2021192648A1,0,公开,发明申请,DETERMINING USER INTERFACE INFORMATION BASED ON LOCATION INFORMATION,"In some examples, a computing device may receive, from a plurality of merchant devices associated with a plurality of merchants, respectively, electronic communications indicating pickup locations associated with the respective merchants. The computing device may access map information to determine a group of the respective pickup locations within a threshold distance of each other, the group of respective pickup locations corresponding to a group of the merchants. The computing device may send, to a buyer device, based at least on the pickup locations determined to be within the threshold distance of each other, merchant information that causes, at least in part, an application on the buyer device to present a user interface including information about the group of merchants, the information about the group of merchants including an indication that items ordered from the merchants in the group of merchants are available for combined delivery.","DOORDASH, INC.",2021-03-09,G06Q50/12,US17196032,US20210192648A1,2021-06-24,Benjamin R. BERNSTEIN; Jeffrey Frank IACONO; Jesse Lee REISS,企业,G06Q50/12; G06Q30/06; G01S19/12; G06Q10/08,,/docs/US/2021-06-24/US20210192648A1/abs.jpg.150x150.jpg
25,US2021192547A1,0,公开,发明申请,POP-UP SHOP PLANNING SYSTEM,"A mobile system by which pop-up commercial real estate and social commerce sales are generated worldwide to social media market surveys, hashtags, demographics, as well as other relevant search criteria. We are currently entering into what many would call a “retail apocalypse” which characterizes the sharp rise in brick & mortar retail business closing stores worldwide due to the booming e-commerce market. As a result, the job market has seen a plummet in retail positions; this system is not only designed to provide stability within the retail job market but is also designed to change the retail job description from just the typical sales agent to event planners and managers. This system is designed to be compatible with current social media platforms and media viewers via open source and API, in order to stimulate the marketing aspect of this system. There are five possible titles by which a user of this system can be defined as, a sponsor, retailer, event builder, pop up realtor, and the consumer. Type of account the user holds will be indicated on their social media pages via open source.",Alexandra Valentina Henderson,2021-03-09,G06Q30/02,US17249679,US20210192547A1,2021-06-24,Alexandra Valentina Henderson,其他,G06Q30/02; G06F16/29; G06Q50/00,,/docs/US/2021-06-24/US20210192547A1/abs.jpg.150x150.jpg
26,US2021192487A1,0,公开,发明申请,Secure Electronic Payment System,"A novel method of allowing secure payments from a purchaser to a seller through the utilization of a combined server platform/vault server system. Such a system entails the generation of a subscription service that allows for authentication of a consumer's credit card in terms of pre-approved identification for future transactions. Such a system initiates a tokenization procedure through transfer of credit card information to the server platform through the vault program and to issuing banks/card providers. Upon acceptance thereof, the vault server generates a token that correlates to a specific credit card of a specific user that is then stored on the server platform. Upon request from a subscribing merchant for acceptance of a tokenized card for payments, the user merely needs to provide an identifying code to access the card for such a purpose.",PAAY LLC,2021-03-09,G06Q20/24,US17196251,US20210192487A1,2021-06-24,Aaron Mendlowitz; James Ruffer,企业,G06Q20/24; G06Q20/38; G06Q20/40,,/docs/US/2021-06-24/US20210192487A1/abs.jpg.150x150.jpg
27,US2021192438A1,0,公开,发明申请,POWER TOOL COMMUNICATION SYSTEM,"A mobile device and method for determining power tool attendance. The mobile device and method are able to generate a list of power tools that are missing based on being outside of communication range with the mobile device. For example, the mobile device includes a short-range transceiver, a memory, and a processor coupled to the memory and the short-range transceiver. The processor is configured to receive a list of a first plurality of power tools and receive, via a user interface, a selection to detect nearby tools. The processor is also configured to receive, via the short-range transceiver, identification signals from a second plurality of power tools and determine that a subset of the first plurality of power tools is missing based on the identification signals. The processor is further configured to generate an indication that the subset of the first plurality of power tools is missing.",Milwaukee Electric Tool Corporation,2021-03-09,G06Q10/08,US17196188,US20210192438A1,2021-06-24,Stephen Matson; Christian Coulis,企业,G06Q10/08; G06F3/0484; G06F3/0482,,/docs/US/2021-06-24/US20210192438A1/abs.jpg.150x150.jpg
28,US2021192082A1,0,公开,发明申请,"DATA PROCESSING SYSTEMS FOR VALIDATING AUTHORIZATION FOR PERSONAL DATA COLLECTION, STORAGE, AND PROCESSING","In particular embodiments, a data processing consent management system may be configured to utilize one or more age verification techniques to at least partially authenticate the data subject's ability to provide valid consent (e.g., under one or more prevailing legal requirements) in order to collect, store, and or process the subject's personal data. For example, according to one or more particular legal or industry requirements, an individual (e.g., data subject) may need to be at least a particular age (e.g., an age of majority, an adult, over 18, over 21, over 13, or any other suitable age) in order to provide valid consent. Data processing systems may generate and store one or more consent records memorializing valid consent for data processing from data subjects in response to confirming that the data subject is old enough to provide such consent.","OneTrust, LLC",2021-03-09,G06F21/62,US17196570,US20210192082A1,2021-06-24,Kevin Jones; Jonathan Blake Brannon,企业,G06F21/62; G06F21/60,,/docs/US/2021-06-24/US20210192082A1/abs.jpg.150x150.jpg
29,US2021191542A1,0,公开,发明申请,DISPLAY HAVING OPAQUE MEMBER DISPOSED IN AREA SURROUNDED BY PIXELS AND ELECTRONIC APPARATUS HAVING THE SAME,"An electronic device according to certain embodiments may include: a sensor, a display panel including a sensor area overlaying or underlying the sensor and a pixel area including at least one pixel and a drive wiring line configured to drive the at least one pixel while surrounding the sensor area, a window disposed over the display panel, and one or more opaque members disposed between the sensor and the window and along an edge of the sensor area.","Samsung Electronics Co., Ltd.",2021-03-09,G06F3/047,US17195892,US20210191542A1,2021-06-24,Songhee JUNG; Yongkoo HER; Sungyoung SHIN; Byungduk YANG; Harksang KIM; Hyunchang SHIN; Joongyu LEE,企业,G06F3/047; G06F3/041; G06F3/0488,,/docs/US/2021-06-24/US20210191542A1/abs.jpg.150x150.jpg
30,US2021191530A1,0,公开,发明申请,ELECTRONIC DEVICE HAVING MULTI-FUNCTIONAL HUMAN INTERFACE,"A multi-functional human interface device includes a control unit and a first multi-functional input button. The first multi-functional input button includes a cover unit configured to receive a touch input of a user's finger, an electrode unit including a transmitter and a receiver to form an electric field, an elastic unit configured to move from a first height to a second height when a first pressure is applied from the cover unit and configured to move back to the first height when the first pressure from the cover unit is released, and a switch unit configured to generate an electric signal representing an input of a predetermined letter.","INNOPRESSO, INC.",2021-03-09,G06F3/02,US17196275,US20210191530A1,2021-06-24,Eunhyung CHO,企业,G06F3/02; G06F3/038; G06F3/0354,,/docs/US/2021-06-24/US20210191530A1/abs.jpg.150x150.jpg
31,US2021191487A1,0,公开,发明申请,METHODS AND APPARATUS RELATING TO THE SUPPLY OF POWER TO POWER OVER ETHERNET DEVICES,"An access point, which is a Power over Ethernet (PoE) Powered Device (PD) measures input voltage and input current. The access point determines a power requirement of the access point based on the measured current, measured voltage, and information about power requirements of access point components or devices coupled to the access point a power requirement of the access point. The access point communicates the determined power request to a power sourcing equipment (PSE), e.g., a network switch. In some embodiments, the access point further communicates one of: measured input current and measured input voltage to the PSE. The PSE uses the information received from the access point, e.g., power request and power measurements to determine an amount of power to be granted to the access point. If the access point does not receive the requested power level the access point selects internal components and/or external devices to de-power.","Juniper Networks, Inc.",2021-03-09,G06F1/26,US17196439,US20210191487A1,2021-06-24,Josh Rosenthal; John Musante,企业,G06F1/26; H04L12/10; H04L12/40; G06F1/3206,,/docs/US/2021-06-24/US20210191487A1/abs.jpg.150x150.jpg
32,US2021191456A1,0,公开,发明申请,Speaker Assembly in a Display Assistant Device,"In a display assistant device, a speaker is mounted in a waveguide structure which is at least partially disposed beneath a display screen. The waveguide structure is mounted in an exterior housing which includes speaker grills distributed on a plurality of surfaces of the exterior housing, permitting sound waves from the speaker to be projected outside the exterior housing. A cover structure is disposed on top of the waveguide structure to conceal the waveguide structure and speaker within the exterior housing. The cover structure has a tilted bottom surface configured to be suspended above the waveguide structure and to be separated by a first space. Sound waves projected from an upper portion of the speaker are reflected by the tilted bottom surface and are guided through the first space to exit the device from a speaker grill portion located on a rear side of the exterior housing.",Google LLC,2021-03-09,G06F1/16,US17196060,US20210191456A1,2021-06-24,James Nelson Castro; Carl Alexander Cepress; Liang Ching Tseng; Darren Torrie; Frances Maria Hui Kwee; Rex Pinegar Price,企业,G06F1/16; G02F1/1333; G02F1/1337; G06F3/16; G10L15/28; G06F21/83; H04R1/02; H04R1/34,,/docs/US/2021-06-24/US20210191456A1/abs.jpg.150x150.jpg
33,US2021189213A1,0,公开,发明申请,THERMAL INTERFACE MATERIAL,"Provided herein is a composition for use as a thermal interface material in a heat-generating device. The composition comprises a first part and a second part, the first part comprising polyisobutylene, a reactive diluent mixture, a catalyst, and one or more thermally conductive fillers, and the second part comprising polyisobutylene, the reactive diluent mixture, a silicone based cross-linker, an inhibitor and one or more thermally conductive fillers.",HENKEL IP & HOLDING GMBH,2021-03-09,C09K5/14,US17195722,US20210189213A1,2021-06-24,Yu CHEN; Lynnette M. HURLBURT; Andrew D. MESSANA; Kevin J. WELCH; Robert Parkins CROSS,企业,C09K5/14; C08G77/442; H05K7/20,,/docs/US/2021-06-24/US20210189213A1/abs.jpg.150x150.jpg
34,US2021188604A1,0,公开,发明申请,LIFT ASSEMBLY SYSTEMS AND METHODS,"A lift assembly including an article to be lifted between a lowered position and a raised position, a flexible drive element coupled to the article and defining a longitudinal axis, a power mechanism coupled to the flexible drive element, a drum powered by the power mechanism and dimensioned to facilitate winding of the flexible drive element onto the drum, and a cable keeper providing a force on the flexible drive element to bias the flexible drive element toward the drum.","Electronic Theatre Controls, Inc.",2021-03-09,B66D5/16,US17195725,US20210188604A1,2021-06-24,"Donald A. Hoffend, III; William R. Florac; Michael Lichter; Edwin W. Bolz",企业,B66D5/16; F16M13/02; A63J1/02; G01L5/102; G01L5/107; B66D1/38; B66D1/56,,/docs/US/2021-06-24/US20210188604A1/abs.jpg.150x150.jpg
35,US2021188065A1,0,公开,发明申请,Vehicle Cover And Integrated Security System,"A system includes a vehicle cover, a mechanical tensioning device, a memory device, storing instructions, and one or more processors configured to execute instructions to perform the steps of a method to secure a vehicle. The mechanical tensioning device may include attachment means to attach the device to a wheel of the vehicle and means to attach a security cable of the vehicle cover integrated into a bottom edge of the vehicle cover to the mechanical tensioning device. The mechanical tensioning device may include a rotational reel connected to either a tensioning motor or a tensioning crank and optionally including either a mechanical bi-stable device or one or more sensors configured to monitor the tension of the security cable when engaged to the mechanical tensioning device. The processor may monitor for a change in tension and execute one or more security measures in response.","SinchTech Covers, LLC",2021-03-09,B60J11/04,US17196916,US20210188065A1,2021-06-24,David Allen Mellick; Patrick Michael Molvik; Robert Dean Bittick; Lisa Marie Daniels,企业,B60J11/04; B60R25/30; B60R25/102; B60R25/10,,/docs/US/2021-06-24/US20210188065A1/abs.jpg.150x150.jpg
36,US2021186088A1,0,公开,发明申请,ELECTRONIC CIGARETTE AND ATOMIZER THEREOF,"The present disclosure provides an electronic cigarette atomizer, including an atomization assembly and a liquid reservoir engaging with the atomization assembly; the liquid reservoir includes a liquid storage cavity; wherein the atomization assembly includes a lower holder, an upper holder installed on the lower holder, and a heating assembly clamped between the lower and the upper holders; the heating assembly includes a porous body and at least one heater engaging with the porous body, and the porous body has an atomizing surface and a liquid-absorbing surface; and the liquid-absorbing surface communicates with the liquid storage cavity, and an atomization cavity is formed between the atomizing surface and the lower holder. In the present disclosure, the heating assembly is a porous body and is clamped by the upper holder and the lower holder, thus, the structure is stable and the assembly of the heating assembly is facilitated.",SHENZHEN SMOORE TECHNOLOGY LIMITED,2021-03-09,A24F1/00,US17196971,US20210186088A1,2021-06-24,Xiaoping LI; Changyong YI; Zhenlong JIANG,企业,A24F1/00; A61M11/04; C04B35/00; A61M15/06; A24F40/46; A24F40/485,,/docs/US/2021-06-24/US20210186088A1/abs.jpg.150x150.jpg
37,US2021185979A1,0,公开,发明申请,Electronic Ear Tag,"An electronic ear tag allows an individual to track a herd animal. Further, the electronic ear tag is an ultra-low power, and lightweight tag that runs only when needed. The electronic ear tag includes a substrate, a microcontroller, a rechargeable battery, a wireless communication module, a global positioning system (GPS) module, and a solar panel. The substrate is a circuit board used to support the electronic components of the present invention. The microcontroller is used to manage and control the electronic components of the electronic ear tag. The rechargeable battery is the main power source of the electronic ear tag. The wireless communication module allows the electronic ear tag to communicate with a central network. The GPS module allows the electronic ear tag to communicate with a GPS satellite. The solar panel converts solar energy into electrical energy used to charge the rechargeable battery.",Andy Doyle Jones,2021-03-09,A01K11/00,US17196993,US20210185979A1,2021-06-24,Andy Doyle Jones,其他,A01K11/00; G08C17/02,,/docs/US/2021-06-24/US20210185979A1/abs.jpg.150x150.jpg
38,US2021185978A1,0,公开,发明申请,"Method of Implementing a Lightweight, Electronic Ear Tag for Location Tracking and Geo-Fencing Tasks","A method of implementing a lightweight, electronic ear tag allows for location tracking and geo-fencing tasks of a herd animal. A location-tracking device tracks spatial-positioning data of electronic ear tag. A communication node relays the spatial-positioning data to at least one remote server hosting an owner account that allows the owner to interact with the electronic ear tag. Accordingly, the spatial-positioning data is relayed from a low-power transceiver to a low-power gateway, if the electronic ear tag is in communication with the communication node. If the electronic ear tag is not in communication with the communication node, the spatial-positioning data is archived and store locally in the electronic ear tag. A high-power gateway provided at the communication node relays the spatial-positioning data to the remote server. Accordingly, the remote server generates a graphical representation of the spatial-positioning data, which is finally displayed on a personal computing device of the owner.",Andy Doyle Jones,2021-03-09,A01K11/00,US17196987,US20210185978A1,2021-06-24,Andy Doyle Jones,其他,A01K11/00; A01K29/00; H04W4/021; H04W4/029; H04W4/12,,/docs/US/2021-06-24/US20210185978A1/abs.jpg.150x150.jpg
39,US2021195391A1,0,公开,发明申请,DIFFERENT PROFILES FOR SELECTING DIFFERENT NETWORK INTERFACES FOR COMMUNICATIONS OF AN ELECTRONIC DEVICE,"In some examples, an electronic device includes a plurality of network interfaces to communicate over respective different networks, and a storage medium to store information associating a first application of the electronic device with a first profile, and associating a second application of the electronic device with a second profile. The first profile selects a first network interface of the plurality of network interfaces to use for communications, and the second profile selects a second network interface of the plurality of network interfaces to use for communications.",BlackBerry Limited,2021-03-08,H04W4/60,US17195059,US20210195391A1,2021-06-24,Michael John Rogan,企业,H04W4/60; H04L12/46; H04L29/08; H04W8/18; H04W92/10,,/docs/US/2021-06-24/US20210195391A1/abs.jpg.150x150.jpg
40,US2021195293A1,0,公开,发明申请,Media Presentation Device with Voice Command Feature,"A media presentation device determines a voice command associated with media content presented by the media presentation device. The media presentation device then listens for and detects utterance of the determined voice command during presentation of the media content, and the media presentation device responds to the detected utterance by performing an action that facilitates user purchase of the good or service associated with the media content segment.","The Nielsen Company (US), LLC",2021-03-08,H04N21/478,US17194581,US20210195293A1,2021-06-24,John R. Burbank; Kurt Roman Thielen,企业,H04N21/478; H04N21/2389; H04N21/658; G10L15/26,,/docs/US/2021-06-24/US20210195293A1/abs.jpg.150x150.jpg
41,US2021195097A1,0,公开,发明申请,"SYSTEMS, DEVICES, AND METHODS FOR ENABLING CAMERA ADJUSTMENTS","Determine a current position of a camera relative to a road based on a set of imagery from the camera and a recommended position of the camera relative to the road based on the set of imagery from the camera, while the camera is maintained at a constant height relative to the road and a constant lateral distance relative to the road. The camera can be positionally adjusted from the current position to the recommended position based on a movement of the camera about a Y-axis or a Z-axis of the camera at that time relative to the road. In order to enable movement of the camera, a guide can be output to a user such that the user can follow the guide and move the camera from the current position to the recommended position.",Intelligent Security Systems Corporation,2021-03-08,H04N5/232,US17195327,US20210195097A1,2021-06-24,Andrey Nikitin,企业,H04N5/232; H04N5/225; H04N7/18; G06T7/70; G06T7/80; G06K9/00,,/docs/US/2021-06-24/US20210195097A1/abs.jpg.150x150.jpg
42,US2021195011A1,0,公开,发明申请,ENTERTAINMENT SYSTEMS AND METHODS,"A method, device, system, and media are directed to controlling a multi-tuner radio. A voice command may be received and/or filtered. An operation of the radio may be modified based on the voice command. A gesture input may be received through a gesture pad. Another operation of the multi-tuner radio may be modified based on the received gesture input. A fingerprint may be recognized with a gesture pad. A user may be authenticated based on the recognized fingerprint. The operation or the other operation may be personalized based on the fingerprint. User training may be provided for the gesture input.","3D RADIO, LLC",2021-03-08,H04M1/60,US17195459,US20210195011A1,2021-06-24,Michael D. ELLIS,企业,H04M1/60; H04H20/71; H04H60/35; H04H60/74; H04W4/40; H04M1/72442,,/docs/US/2021-06-24/US20210195011A1/abs.jpg.150x150.jpg
