,id,rank,legalStatus,type,title,summary,applicant,applicationDate,mainIpc,applicationNumber,documentNumber,documentDate,inventor,applicantType,ipc,cpc,imagePath
43,US2021194902A1,0,公开,发明申请,"UNAUTHORIZED COMMUNICATION DETECTION METHOD, UNAUTHORIZED COMMUNICATION DETECTION SYSTEM, AND NON-TRANSITORY COMPUTER-READABLE RECORDING MEDIUM STORING A PROGRAM","An unauthorized activity detection method in an onboard network system. The detection method includes determining whether or not a message sent out onto the network is an attack message, saving information relating to the attack message in at least one memory in a case where the message is an attack message, identifying a communication pattern from information relating to the attack message, and determining whether or not the message matches a communication pattern. The determination of whether an attack message and determination of whether matching a communication pattern are executed on each of a plurality of messages received from the network. In the determining of whether an attack message executed on a message received after executing of determining of whether matching a communication pattern, results of the determination of whether an attack message that has already be executed are used.",PANASONIC INTELLECTUAL PROPERTY CORPORATION OF AMERICA,2021-03-08,H04L29/06,US17194514,US20210194902A1,2021-06-24,Manabu MAEDA; Takeshi KISHIKAWA; Daisuke KUNIMUNE,企业,H04L29/06; B60R16/023; G06F21/55,,/docs/US/2021-06-24/US20210194902A1/abs.jpg.150x150.jpg
44,US2021194854A1,0,公开,发明申请,DATA PROCESSING SYSTEMS AND METHODS FOR USING A DATA MODEL TO SELECT A TARGET DATA ASSET IN A DATA MIGRATION,"Data stored on a data asset may be migrated to another data asset while maintaining compliance to applicable regulations. A data asset may experience a failure. Based on the type of data stored by that data asset and the applicable regulations, requirements, and/or restrictions that relate to a transfer of that type data from that data asset, a target data asset may be determined. The data stored on the data asset may then be transferred to the target data asset. The disclosed systems may use data models and/or data maps in determining the requirements for a data transfer and selecting target data assets.","OneTrust, LLC",2021-03-08,H04L29/06,US17194662,US20210194854A1,2021-06-24,Arockia Gunasingam; Steven W. Finch; Saravanan Pitchaimani; Kevin Jones; Jonathan Blake Brannon,企业,H04L29/06; G06F21/62; G06F16/21,,/docs/US/2021-06-24/US20210194854A1/abs.jpg.150x150.jpg
45,US2021193917A1,0,公开,发明申请,TWO-TERMINAL REVERSIBLY SWITCHABLE MEMORY DEVICE,A memory using mixed valence conductive oxides is disclosed. The memory includes a mixed valence conductive oxide that is less conductive in its oxygen deficient state and a mixed electronic ionic conductor that is an electrolyte to oxygen and promotes an electric filed to cause oxygen ionic motion.,HEFEI RELIANCE MEMORY LIMITED,2021-03-08,H01L45/00,US17194609,US20210193917A1,2021-06-24,"Darrell RINERSON; Christophe J. CHEVALLIER; Wayne KINNEY; Roy LAMBERTSON; John E. SANCHEZ, JR.; Lawrence SCHLOSS; Philip SWAB; Edmond WARD",企业,H01L45/00; G11C11/56; G11C13/00; H01L27/24; G06F30/30,,/docs/US/2021-06-24/US20210193917A1/abs.jpg.150x150.jpg
46,US2021193277A1,0,公开,发明申请,SYSTEMS AND METHODS FOR SURFACING CONTEXTUALLY RELEVANT CONTENT INTO THE WORKFLOW OF A THIRD PARTY SYSTEM VIA A DISTRIBUTED ARCHITECTURE,"Systems and methods for surfacing contextually relevant data into the workflow of a third party system are discussed herein. The system implements a near-real-time method of detecting activity corresponding to particular electronic health records associated with particular patients in third-party systems using specifically configured software systems. A cloud-based micro-services architecture is communicably coupled to the third-party systems and is operable to transmit contextually relevant data to the third-party system in response to particular detected activities, such as accessing a patient's electronic health record. The contextually-relevant data is identified by comparing electronic health record data from various third-party systems, each third-party system associated with the particular patient, to determine gaps in the records. The contextually relevant data is transmitted to the third-party system and visually integrated into the third-party system's pre-existing clinical workflow.",SNAPS Solutions LLC,2021-03-08,G16H10/60,US17194426,US20210193277A1,2021-06-24,"Robert Emmitt Connely, IV; Bryant Paul Castleton; James Tropauer; Saurabh Mathur",企业,G16H10/60; G06F16/26; G06F16/27; H04W12/02; G16H40/67; G16H20/00; H04L29/08; G06Q40/08; G06Q10/06; G16H40/20; G16H40/63; G16B20/10; G16H30/20; G16H20/10,,/docs/US/2021-06-24/US20210193277A1/abs.jpg.150x150.jpg
47,US2021193176A1,0,公开,发明申请,CONTEXT-BASED DETECTION OF END-POINT OF UTTERANCE,"Detecting an end-point of user's voice command or utterance with high accuracy is critical in automatic speech recognition (ASR)-based human machine interface. If an ASR system incorrectly detects an end-point of utterance and transmits this incomplete sentence to other processing blocks for further processing, it is likely the processed result would lead to incorrect interpretation. A method includes selecting a first semantic network based on context of the audio signal and more accurately detecting the end-point of user's utterance included in the audio signal based on the first semantic network and also based on at least one timeout threshold associated with the first semantic network.",QUALCOMM Incorporated,2021-03-08,G10L25/87,US17195578,US20210193176A1,2021-06-24,Paras Surendra DOSHI; Ayush Agarwal; Shri Prakash,企业,G10L25/87; G10L15/05; G10L15/19; G10L15/22,,/docs/US/2021-06-24/US20210193176A1/abs.jpg.150x150.jpg
48,US2021192898A1,0,公开,发明申请,SYSTEM AND METHOD FOR UTILIZING VIRTUAL TICKET VOUCHERS,The present disclosure relates generally to a system that utilizes virtual ticket vouchers in association with one or more transactions involving one or more components of a gaming establishment ecosystem.,IGT,2021-03-08,G07F17/32,US17195195,US20210192898A1,2021-06-24,Erik Petersen; Kevin Higgins; Adrian Marcu,企业,G07F17/32,,/docs/US/2021-06-24/US20210192898A1/abs.jpg.150x150.jpg
49,US2021192858A1,0,公开,发明申请,ELECTRONIC DEVICE FOR GENERATING IMAGE INCLUDING 3D AVATAR REFLECTING FACE MOTION THROUGH 3D AVATAR CORRESPONDING TO FACE AND METHOD OF OPERATING SAME,"An electronic device is provided. The electronic device includes a camera, a display, and a processor configured to obtain a first image including one or more external objects by using the camera, display to output a three-dimensional (3D) object generated based on attributes related to a face among the one or more external objects using the display, receive a selection of at least one graphic attribute from a plurality of graphic attributes which can be applied to the 3D object, generate a 3D avatar for the face based on the at least one graphic attribute, and generate a second image including at least one object reflecting a predetermined facial expression or motion using the 3D avatar.","Samsung Electronics Co., Ltd.",2021-03-08,G06T19/20,US17194837,US20210192858A1,2021-06-24,Wooyong LEE; Yonggyoo KIM; Byunghyun MIN; Dongil SON; Chanhee YOON; Kihuk LEE; Cheolho CHEONG,企业,G06T19/20; G06T11/00; G06T13/40,,/docs/US/2021-06-24/US20210192858A1/abs.jpg.150x150.jpg
